Autores,Asesores,Título,Resumen,Año,Institución,Grado
"['Gutierrez Salas, Jorge Joao', 'Navarro Alzamora, Julio Cesar', 'Quinteros Navarro, Dino Michael', 'Valdivia Málaga, Rodrigo Leonel']","['Cuervo Guzmán, Sergio']",Factores que determinan la adopción de la facturación electrónica vía SMS por las MYPES de Lima,"La Superintendencia Nacional de Administración Tributaria (SUNAT), es la encargada, entre otras funciones, de recaudar impuestos de diferente origen en nuestro país. En la actualidad esta se puede realizar de manera física y/o electrónica; siendo esta ultima la que brinda mejores capacidades sobre todo por temas de automatización; creándose un ecosistema, en el que empresas como proveedores de servicios electrónicos (PSE) brindan servicios de emisión electrónica. La SUNAT prevé a largo plazo que la facturación electrónica reemplace a la facturación física el 100% de los casos; sin embargo, la realidad de nuestro país hace notoria diversas dificultades para este cometido, principalmente por la conectividad a internet. Ante ello se plantea una solución que no requiera conexión a internet, simplemente red telefónica, como es una arquitectura basada en emisión por SMS, cubriéndose así un mayor territorio. Creemos que las empresas más grandes tendrían alguna dificultad para usar este sistema ya que emiten muchas facturas en periodos cortos y una solución de SMS al menos en una solución básica sería poco usable. Además de ello, estas tienen la capacidad de obtener servicios de una PSE por su fuerte financiero.",2018,Universidad ESAN,['Maestro en Dirección de Tecnologías de Información']
"['Fajardo Castro, Jimy Robert', 'Mercado García, Jenny Reneé', 'Morales Ayala, Zénil Salomé', 'Sánchez Díaz, Oscar Gulmaro', 'Santillán León, Carlos Manuel']","['Cuervo Guzmán, Sergio']",Plan de negocio para un sistema de intermediación de servicios de belleza en la ciudad de Lima basado en la geolocalización,"El crecimiento sostenido del sector belleza en el Perú y los hábitos de consumo de los peruanos en sus compras en línea han sido factores importantes para comenzar con esta idea de negocio. Esta idea de negocio busca brindar una plataforma de intermediación que permita unir la oferta y la demanda en el sector belleza, modelo de negocio similar a Uber, de tal forma que tanto el profesional o el salón de belleza puedan ofrecer y llevar ese servicio hacia la ubicación indicada por el usuario. Esta solución propone llegar a hombres y mujeres entre 18 y 59 años que viven o trabajan en la ciudad de Lima, en los distritos de Lima moderna, utilizan la tecnología en sus actividades cotidianas y cuidan su imagen personal. El estudio de mercado realizado demuestra que la idea de negocio es aceptada por el 81% de los encuestados. Asimismo, se realizó entrevista a un grupo determinado de expertos de distintas áreas quienes aportaron de gran forma a esta idea de negocio. Esta idea es rentable, esto se sustenta en el plan financiero desarrollado en la tesis, esta viabilidad es atractiva antes los ojos de los inversionistas quienes serán nuestros aliados estratégicos.",2018,Universidad ESAN,['Maestro en Dirección de Tecnologías de Información']
"['Aguilar Araujo, Carlos Eduardo', 'Lau Alayo, Eduardo Roberto', 'Olivera Kalinowski, Sandro', 'Polanco Ramos, Cristian Arthur']","['Yrigoyen Quintanilla, Guillermo Manuel']","Propuesta de implantación del Cyber Security Framework (CSF) del NIST, usando COBIT, en Honda del Perú","Bajo la premisa de analizar la ciberseguridad como un tema de alta relevancia para los procesos de transformación digital que están ocurriendo en los diferentes tipos de organizaciones, la presente tesis busca evaluar los resultados de aplicar la gestión de la ciberseguridad a una empresa peruana, para lo cual se ha elegido a Honda del Perú - HDP - como objeto de estudio, y al Cyber Security Framework (CSF) del National Institute of Standards and Technology (NIST), usando COBIT 5, como el marco de referencia a ser aplicado. Por lo tanto, en el presente trabajo se plantean los siguientes objetivos específicos: - Determinar los tres componentes principales de la problemática identificada al implantar un framework de ciberseguridad en una empresa peruana. - Sugerir estrategias de solución a los tres principales problemas identificados al implantar un framework de ciberseguridad en una empresa peruana. - Proponer un plan de acción para la gestión de la ciberseguridad en HDP.",2017,Universidad ESAN,['Maestro en Dirección de Tecnologías de Información']
"['Angobaldo Luna, Daniella', 'Chang Mariselli, Sergio', 'De los Santos Daza, Juan', 'Vela Ruiz, Jorge']","['Morris Abarca, Eddy']",Plan de negocio para la creación de una empresa que ofrezca servicios digitales para la gestión del vehículo,"La presente tesis tiene por objetivo general desarrollar un modelo y plan de negocio para la creación de una empresa que ofrece servicios digitales enfocados en la gestión eficiente del vehículo, a través de la aplicación móvil Voy Smart, habilitando la transformación de la experiencia tradicional en una experiencia Smart. Los objetivos específicos propuestos son: desarrollar el modelo y plan de negocio considerando las estrategias, acciones y medios a utilizar para concretar la oportunidad de negocio; realizar un estudio de mercado que permita conocer el público objetivo al cual la empresa dirigirá sus servicios, así como definir la demanda potencial, identificando las necesidades y valor distintivo para el consumidor; definir las capacidades humanas, tecnológicas y financieras que demandará el modelo de negocio e identificar los factores críticos de éxito para la viabilidad del negocio.",2017,Universidad ESAN,['Maestro en Dirección de Tecnologías de Información']
"['Alvarez Rodríguez, Pascual Arturo', 'Arce Enriquez, Marco Antonio', 'Juárez Castillo, Martín Esteban']","['Santana Ormeño, Martín']",Plan de negocio para la implementación de una plataforma tecnológica para el monitoreo y control de pacientes con diabetes e hipertensión en Perú,"El presente plan de negocio demuestra que es factible aprovechar las oportunidades del entorno y las capacidades de la telemedicina móvil (mSalud) para obtener ventajas competitivas a partir de un modelo de negocio para el control del tratamiento de pacientes con diabetes e hipertensión de las entidades prestadoras de salud EPS. La propuesta de servicio que se ofrecerá consiste en una plataforma de mSalud, a través de un software en la nube, que ayude a que los pacientes crónicos, diabéticos e hipertensos, en la adherencia y control del tratamiento de su enfermedad de una forma efectiva, simple y lúdica. El mercado objetivo serán los programas de control de enfermedades crónicas de las EPS.",2017,Universidad ESAN,['Maestro en Dirección de Tecnologías de Información']
"['Fernández Castañeda, Vicente Raúl', 'Luna Huaringa, Carlos Christopher Edgar']","['Arbaiza Fermini, Lydia Aurora']",Sistema de bicicletas compartidas : plan de negocio y su aplicación en la ciudad de Lima,"Habiendo tomado conocimiento que las municipalidades distritales del Lima, están fomentando el uso de energías renovables, políticas para la conservación del medio ambiente y estrategias para solucionar la congestión vehicular y la contaminación ambiental, se identificó una oportunidad de negocio para la implementación de un sistema de bicicletas compartidas en el distrito de San Isidro, por lo tanto se ha decidido elaborar un plan de negocio para establecer los mecanismos técnicos financieros de implementación del servicio de alquiler de bicicletas, para cumplir con los objetivos, tales como: - Reducir el transito que se genera en el distrito de San Isidro. - Implementar un medio de transporte ecológico de bajo costo. - Contribuir con las políticas de conservación del medio ambiente de las municipalidades distritales. - Generar rentabilidad a partir de un modelo de negocio innovador.",2017,Universidad ESAN,['Maestro en Dirección de Tecnologías de Información']
"['Belito Subilete, Carmen', 'Carranza Palomino, Vladimir Eder', 'Hereña Castro, Sandra Vanessa', 'Osorio Gamarra, Carlos Alberto', 'Sánchez Rojas, Vicky Fiorella']","['Santana Ormeño, Martín']",Plan de negocio para facilitar la gestión comercial de los agentes turísticos en Lima Metropolitana,"La presente tesis tiene como objetivo general desarrollar un plan de negocio para facilitar la gestión comercial de los operadores turísticos en Lima Metropolitana, a través de una plataforma de servicios por internet. Los objetivos específicos planteados son: (1) Analizar las necesidades del sector turismo enfocado en los servicios que brindan los operadores de turismo, (2) Diseñar una plataforma digital que facilite a los operadores de turismo un nuevo canal de ventas on-line, (3) Analizar la demanda potencial de operadores de turismo y turistas internos, (4) Generar un aporte al sector por medio de facilitadores tecnológicos.",2017,Universidad ESAN,['Maestro en Dirección de Tecnologías de Información']
"['Aguilar Cabello, Alex Yordano', 'Lagos Rojas, César Augusto', 'Pérez Mejía, Dunay Alfredo', 'Quiroz Farfán, Edward Jesús', 'Rojas Tello, Francisco Alexander']","['Arbaiza Fermini, Lydia Aurora']",Plan de negocios para la implementación de una plataforma de smart mobility mediante el uso de la bicicleta en la zona financiera de San Isidro,"El presente trabajo de investigación busca elaborar, diseñar y sustentar la viabilidad de un Plan de Negocios para la implementación de una plataforma tecnológica de Smart Mobility; mediante el uso de la bicicleta como medio de transporte complementario y/o alternativo. Teniendo en cuenta lo expuesto, se ejecutará el análisis para la zona financiera del distrito de San Isidro con la finalidad de aportar bases para la implementación de iniciativas de Smart Mobility.",2017,Universidad ESAN,['Maestro en Dirección de Tecnologías de Información']
"['Cevallos Vera, Johana Pamela', 'Chirichigno Mena, Luis Miguel', 'Matos Melgar, Jonathan', 'Utrilla Vilca, Elmer Néstor']","['Cuervo Guzmán, Sergio']",Desarrollo de un plan de negocio para evaluar la viabilidad de implementar la estrategía de omnicanalidad en Casa Más,"La presente tesis tiene como objetivo evaluar la viabilidad de implementar la estrategia de omnicanalidad en Casa Más, una de las marcas de la empresa Inversiones CYS que atiende a los consumidores del nivel socioeconómico B y C.",2017,Universidad ESAN,['Maestro en Dirección de Tecnologías de Información']
"['Janampa Goicochea, Arturo', 'Poma Tolentino, Jorge Alberto', 'Toledo Medina, Emerson', 'Villasis Ramirez, Vladimir']","['Santana Ormeño, Martín']",Plan de negocio para la creación de un negocio de intermediación de servicios legales para MYPES,"El modelo de negocio propuesto plantea mejorar la experiencia de contratación de abogados a las MYPES, agilidad en la atención y brindándole un abogado especialista acorde a su necesidad. Y por el lado de los abogados permitirles incrementar la cartera de clientes, mejorar la marca profesional y acceder a una red de negocios. El modelo de negocio cumple una doble función, por un lado, permitirá a las MYPES expresar su problema o necesidad y agilizar el proceso de contratación de abogados. Por otro lado, a los abogados brindar servicios legales de una manera virtual, asegurando que la comunicación entre ambos sea directa y online.",2017,Universidad ESAN,['Maestro en Dirección de Tecnologías de Información']
"['Cotrina Castañeda, Lider Jen', 'Cuzcano González, Ronald Iván', 'Machicao Mendoza, Oskar', 'Terrones Carrasco, Iván Enrique', 'Valdivia Pilco, Luis Alberto']","['Santana Ormeño, Martín']",Plan de negocio para la implementación de una plataforma colaborativa de lotería virtual en Perú,"La presente tesis tiene como objetivo general desarrollar un plan de negocio para la implementación de una plataforma colaborativa de lotería virtual en Perú, a través de una plataforma implementada en Internet. Entre los objetivos específicos planteados en el presente trabajo se tiene: (1) Conocer el marco contextual de las loterías en el modelo tradicional y virtual, (2) Diseñar un modelo de negocio que permita aprovechar las preferencias de los usuarios peruanos, fortaleciendo la relación de los usuarios y atrayendo nuevos jugadores, (3) Diseñar la arquitectura tecnológica que soporte el modelo de negocio propuesto y el público potencial, (4) Realizar la evaluación económica financiera del proyecto que contenga las estructuras de costo e ingresos además de los flujos de caja e indicadores.",2017,Universidad ESAN,['Maestro en Dirección de Tecnologías de Información']
"['Carrasco Samaniego, Jesús Max', 'Chombo Hidalgo, Freddy Orlando', 'Huayta Alzamora, Denny Antonio', 'Uribe Sánchez, Christian Valery']","['Morris Abarca, Eddy']",Plan de negocio de una aplicación móvil orientada al adulto mayor,"El objetivo principal de esta tesis es la concepción de un Plan de Negocios para el desarrollo de una aplicación móvil que sirva como un asistente para los adultos mayores. De esta manera, se busca mejorar la calidad de vida de los mismos. Se propuso un modelo de negocio cuya propuesta de valor es: ""Mejorar la calidad de vida de los adultos mayores, brindando herramientas para el cuidado de la salud, entretenimiento y ofertas, en una sola aplicación"". Este modelo de negocio satisface las necesidades identificadas para el segmento de población adulto mayor.",2017,Universidad ESAN,['Maestro en Dirección de Tecnologías de Información']
"['Chávez Retamozo, Luis Bruno', 'Cruz Osorio, Pedro Ronald', 'Domínguez Ticlia, Niels Danny', 'Osorio Llerena, Juan José', 'Torres Robles, Richard Teodoro']","['Serida Nishimura, Jaime']",Formulación de un estudio de viabilidad para la propuesta de creación de un canal adicional de atención de emergencias en la central 105 mediante el uso de tecnologías de la información,"El presente es un estudio de viabilidad de una propuesta de creación de un canal adicional de transmisión de emergencias policiales, mucho más eficiente y fidedigna. El modelo propuesto no tiene precedente y es de cobertura extensa con factores que son de difícil manejo al tratarse de una Institución que por doctrina consideran su información como reservada o como secreta. Con la presente propuesta se busca disminuir al mínimo posible el tiempo de atención ante un hecho delictivo en progreso, logrando con ello desalentar a la delincuencia en su accionar, contribuyendo a la generación de servicios de calidad que la sociedad demanda y a la mejora la imagen Institucional.",2017,Universidad ESAN,['Maestro en Dirección de Tecnologías de Información']
"['Díaz Amaya, Edgar', 'Hualpa Medrano, Daniel', 'Rodenas Seytuque, Julio', 'Romero Solís, Michael']","['Arbaiza Fermini, Lydia Aurora']",Plan de negocio para crear una empresa de intermediación laboral en proyectos TI,"El presente plan de negocios busca ofrecer al mercado laboral una herramienta de vinculación laboral que permitirá a empresas y especialistas TI a relacionarse para ejecutar de manera conjunta proyectos y actividades relacionadas al rubro de TI, a través de la plataforma web y aplicativo móvil We Got IT, la cual estará disponible para el acceso libre y directo. El motivo principal por el cual surge esta idea de negocio es la necesidad de ambas partes mencionadas anteriormente. Por el lado de las empresas de cualquier rubro, el escenario de digitalización y desarrollo tecnológico empresarial en la actualidad abre la necesidad de solicitar de manera temporal los servicios de especialistas de TI para proyectos de o actividades específicas relacionadas a TI. Por el lado de los especialistas se tiene un mercado altamente atractivo que busca optimizar tiempos fuera de oficina o no están relacionados laboralmente a la planilla de determinada empresa, por lo que busca incrementar sus ingresos participando en proyectos o actividades de TI en sus horas libres.",2017,Universidad ESAN,['Maestro en Dirección de Tecnologías de Información']
"['Benites López, Carlos', 'Contreras Pedreschi, Jesús Carlos Adolfo', 'Masías Echeverría, Claudia Janet', 'Zamalloa Ambia, Carlos']","['Santana Ormeño, Martín']",Plan de negocio para la implementación de un sistema de fidelización de clientes orientado a la pequeña y mediana empresa,"En la actualidad, las pymes en el Perú, son actores principales dentro de la economía y representan el 99% de las empresas. El 41,2% de las pymes establecidas se encuentran en Lima, sin embargo una de cada diez de las mismas no superan el primer año de operación. Uno de los principales factores de fracaso de las pymes es el desconocimiento y falta de gestión de sus clientes por lo cual accionar sobre esta área contribuirá a mejorar la gestión y desempeño de estas empresas. Dentro de las pymes observamos que los sectores de restaurantes y centros de belleza presentan las tasas de mayor crecimiento. En particular, los centros de belleza presentan una tasa de 13% de crecimiento anual. A partir de los estudios exploratorios de mercado concluimos que los centros de belleza utilizan esquemas de fidelización básicos que se resumen en cartillas de sellos y puntos, estos esquemas no permiten identificar a los clientes y menos determinar sus preferencias, asimismo para los clientes las cartillas son medios no persistentes y difíciles de administrar. El crecimiento del sector centros de belleza y el uso de esquemas de fidelización básicos perfilan a este sector como el idóneo para presentar la solución de programas de fidelización para pymes. El inicio de operaciones será en la ciudad de Lima y orientado a los niveles socioeconómicos A, B y C que son los que presentan mayores facilidades de consumo en este sector. La tecnología y comunicaciones actuales nos permiten construir un programa de fidelización multimarca a un costo asequible y escalable para los centros de belleza que no disponen de capitales para invertir en soluciones que le permitan identificar, atraer, mantener y rentabilizar a sus clientes. Asimismo incrementará la satisfacción de los usuarios finales de los centros de belleza al tangibilizar los beneficios del programa de fidelización a través de la solución propuesta.",2017,Universidad ESAN,['Maestro en Dirección de Tecnologías de Información']
"['Durazno Herrera, Gino Paul', 'Gil Aguilar, Luis Alberto', 'Mauricio Michuy, Richard John', 'Motta Ruiz, José Ricardo']","['Morris Abarca, Eddy']",Modelo de innovación tecnológica para el proceso de evaluaciones fitosanitarias en Agrícola Chapi S.A.,"El presente trabajo de investigación tiene como objetivo principal plantear un modelo innovador sobre el proceso de evaluaciones fitosanitarias en la empresa Agrícola Chapi S.A. mediante el uso de tecnologías de agricultura de precisión. Este tema surgió ante la problemática en el proceso actual de evaluaciones fitosanitarias, el cual no es capaz detectar a tiempo plagas, enfermedades o incluso la deshidratación que puedan estar sufriendo las plantas, obviamente, esto ocasiona pérdidas parciales o totales en los lotes de cultivos. Ante este escenario, se propone la utilización de un dron equipado con una cámara multiespectral, aprovechando las imágenes en las bandas RGB e infrarrojas, posibilita la detección de las anomalías de los cultivos. Se plantea, además, la integración de esta solución con un sistema web/móvil para mejorar la captura de datos, tomar mejores decisiones y disminuir ostensiblemente las pérdidas económicas.",2017,Universidad ESAN,['Maestro/Magíster en Dirección de Tecnologías de Información']
"['De la Cruz Cisneros, Raúl Alfredo', 'Molina Mendoza, Carlos Enrique', 'Parave Zarate, Anthony Luis', 'Ramírez Peña, Pablo Andrés', 'Shimokawa Hayayumi, Eduardo Daniel']","['Santana Ormeño, Martín']",Plan de negocio para el desarrollo de una empresa que brinde servicios basados en geolocalización para movilidades escolares,"La presente tesis tiene como objetivo general el diseñar y evaluar la viabilidad de un modelo de negocio que brinde servicios innovadores basados en geolocalización para movilidades escolares. Para ello nos hemos propuesto los objetivos específicos de: i) diseñar un modelo de negocio que brinde valor agregado al servicio de movilidad escolar permitiendo mejorar la seguridad, reducir la informalidad y suministrar información de las movilidades escolares; ii) determinar la posible demanda de servicios basados en geolocalización para movilidades escolares en el mercado de la ciudad de Lima Metropolitana y Callao; iii) analizar la oferta de servicios similares en otras ciudades del continente americano; iv) evaluar la viabilidad operativa y financiera de este modelo de negocio.",2017,Universidad ESAN,['Maestro/Magíster en Dirección de Tecnologías de Información']
"['Barreto Loyola, Huber Einer', 'Del Mar Reátegui, Ronnie', 'Farfán Maguiña, Cristóbal', 'Jeri Miranda, Lorena Amparo', 'Paredes Inocente, Abel']","['Robles Flores, José Antonio']",Factores facilitadores para la adopción del internet de las cosas en los hogares,"La tesis presenta el proyecto de adoptar IoT en “hogares tradicionales” para transformarlas en Casas Inteligentes, es una demanda cada vez más importante y también una oportunidad para gobiernos y ciudadanos. Complementado con el surgimiento de la tecnología digital, de Internet y de las tecnologías móviles, esa transformación es cada vez más viable. Para que la adopción de IoT en los hogares sea sostenible, es necesario que esta adopción sea innovadora en el uso de las Tecnologías de la Información y Comunicación (TIC) para mejorar la seguridad y protección, el ahorro de dinero, la comodidad y la paz mental para los usuarios. La adopción de IoT requiere conectividad, sensores distribuidos en el ambiente y sistemas computarizados de gestión inteligente para solucionar problemas inmediatos, organizar escenarios complejos y crear respuestas para atender las necesidades de sus habitantes.",2017,Universidad ESAN,['Maestro/Magíster en Dirección de Tecnologías de Información']
"['Boza González, Fernando', 'Reyes Moggiano, Omar Mario', 'De la Cruz Castillo, Juan César', 'Guadalupe Masías, Rocío Katherine']","['Santana Ormeño, Martín']",Plan de negocio para brindar servicios generales a viviendas a través de una plataforma online,"La presente tesis desarrolla el plan de negocio de HogarFix hemos analizado las principales características de negocio de competidores locales y extranjeros, incorporando aquellas que consideramos importantes para el mercado local así como otras innovadoras, como la búsqueda de expertos cercanos a través de geolocalización desde dispositivos móviles, las cuales forman parte de la propuesta de valor de HogarFix para satisfacer las necesidades de expertos y usuarios. 2 El modelo de negocio propuesto, en un escenario promedio de evaluación con horizonte a 5 años, considera un capital de trabajo de S/.268,449.86 con una inversión inicial de S/.56,428.00 con una tasa de impuesto de 30% y una tasa de descuento del 20%, dando como resultado un VAN de S/.220,733.43 y una TIR de 70%, con un periodo de recuperación al inicio del tercer año.",2017,Universidad ESAN,['Maestro/Magíster en Dirección de Tecnologías de Información']
"['Calderón Garay, Giancarlo Roberto', 'Lluen Gamarra, Jesús Alberto', 'Perea Valderrama, Luis Miguel']","['Arbaiza Fermini, Lydia Aurora']",Plan de negocio para el desarrollo de una empresa de comercialización y distribución de artesanías personalizadas,"La presente tesis tiene como objetivo elaborar un plan de negocio para la creación de una empresa dedicada a la distribución y comercialización de artesanías personalizadas basadas en las preferencias de los clientes, a través de una plataforma de comercio electrónico para venta, personalización y comercialización de artesanías en línea. Se plantearon los siguientes objetivos específicos: a) Analizar la situación actual del sector artesanal en el país, identificando los aspectos externos que influyen en su entorno. b) Identificando las necesidades y expectativas de los clientes con la finalidad de elaborar una propuesta de valor con aquellas estrategias que permitirán cubrir aquellas expectativas. c) Definir el modelo de negocio, sus principales atributos y validar la propuesta a través de la realización de un estudio de mercado. d) Elaborar el plan de marketing con el propósito de definir los medios por el cual se ofrecerán y publicitarán los servicios de venta y comercialización de artesanías. e) Elaborar el plan de operaciones con el propósito de definir los medios y metodologías para la elaboración del sistema informático que brindará soporte a todos los procesos del negocio. f) Elaborar el plan de recursos humanos con el propósito de definir las competencias, habilidades, perfiles de puestos y el personal necesario para el emprendimiento y establecimiento del negocio. g) Elaborar el plan económico-financiero con el propósito de analizar la viabilidad económica del negocio.",2017,Universidad ESAN,['Maestro/Magíster en Dirección de Tecnologías de Información']
