Autores,Asesores,Título,Resumen,Año,Institución,Grado
"['Jerónimo Balcazar, Débora Elsa', 'Larico Mullisaca, Celso Ever', 'Gaspar Gonza, Marcos Luciano', 'Yanac Ortiz, Pedro Antonio']","['Santana Ormeño, Martín']",Plan de negocio para el desarrollo de una plataforma virtual colaborativa de auxilio mecánico vehicular,"La presente tesis, tiene como principal objetivo proponer, diseñar y evaluar un plan de negocios para la creación de una plataforma digital colaborativa denominada AuxiFlash en la ciudad de Lima, en las zonas denominadas Norte, Centro y Moderna. A través de una aplicación móvil, se plantea enlazar a conductores que necesiten asistencia mecánica con una red de conductores que cumplan el rol de auxiliador mecánico, usando las herramientas necesarias para poder solucionar un problema sencillo o complejo que pudiera surgir en ruta. AuxiFlash ofrecerá a los conductores, una propuesta de valor para solucionar un inconveniente mecánico en carretera de manera fácil, rápida y segura, asignándole al auxiliador mecánico idóneo. A su vez ofrecerá a los auxiliadores mecánicos contacto directo con clientes que requieran ayuda en sus vehículos de forma rápida y segura, y puedan obtener ingresos extra.",2021,Universidad ESAN,['Magíster en Dirección de Tecnologías de la Información']
"['Condori Cabana, David Godofredo', 'Monzón Estrella, Antony Abel', 'Peña Barrientos, Paul']","['Cuervo Guzmán, Sergio']",Plan de negocio para una plataforma tecnológica de intermediación de compras en los mercados de abastos de Lima Metropolitana,"La plataforma tecnológica llamada Mi Mercado, es una aplicación de intermediación que permite realizar las compras de productos de primera necesidad en los mercados de abastos sin la necesidad de salir de sus hogares, comparando reseñas de experiencia de compra de otros usuarios y evaluar distintas propuestas de venta de los proveedores, para garantizar el precio justo, el tiempo de entrega y la calidad esperada. De tal manera que los consumidores puedan provisionarse de sus productos sin exponerse a contagios innecesarios, ni a la inseguridad ciudadana, a través de una plataforma tecnológica de fácil uso, rápida, segura y eficiente, que les permita aprovechar el tiempo ganado en destinarlo a la familia o en otras actividades de interés. Parte de la propuesta incluye lograr que los proveedores de productos puedan tener un canal adicional de ventas, que les permita mejorar el posicionamiento de su negocio, controlar su flujo de dinero y proyectar su inventario. Según los expertos entrevistados en nuestro análisis cualitativo, no se encontraron competidores directos que abarquen a nuestros dos clientes y cuenten con la misma propuesta personalizada que ofrecemos, por lo que mantenemos una ventaja consistente frente a los nuevos competidores que se encuentran surgiendo.",2021,Universidad ESAN,['Magíster en Dirección de Tecnologías de la Información']
"['Castillo Ordinola, Dennis Eduardo', 'Estrada Vargas, Hohammed Máximo', 'Tinoco Reyes, David Alejandro']","['Cuervo Guzmán, Sergio']",Plan de negocio para la implementación de una plataforma digital “Tranki” que permita mitigar el estrés para millennials en la Región Lima Metropolitana,"El estrés es considerado como un conjuntode reacciones fisiológicas, en el cual las personas pasan por un  estado físico, mental o también emocional que es causada por presiones  en  diversas  circunstancias  de  la  vida  cotidiana.  En  el  Perú,la  población llamada millennials se sienten ansiosos o estresados por la emergencia sanitaria actual, cuya  cantidad  se  contabiliza  en  aproximadamente  8  millones  de  personas,  las  cuales comparten ciertas características y se considera una generación que no concibe su vida sin el uso de los dispositivos móviles y plataformas digitales. Por esta razón, el presente plan de negocios propone la Plataforma Digital Tranki, la  cual  tiene  el  objetivo  de  proveer  un  servicio  alternativo  que  ofrezca  soluciones oportunas y efectivas a los jóvenes millennials con ansiedad y altos niveles de agitación, con  la  finalidad  de  proporcionarle  formas  didácticas  para  atenuar  los  síntomas  del estrés;por medio de consejos, recomendaciones y planes saludables personalizados y adaptados a la situación actual. Además, se proyecta atender a las personas de la Región Lima Metropolitana, generandouningresoadicional al personal especializado en salud mental que tuviera la oportunidad de brindar sus servicios. Esta idea se posiciona como una alternativa innovadora, que genera un impacto positivo sobre la salud pública.",2021,Universidad ESAN,['Magíster en Dirección de Tecnologías de la Información']
"['Bardales Abad, Jorge Armando', 'Elías Huaranga, Vanessa', 'Manrique Tunque, Nérida Isabel', 'Motta Llufire, Víctor Alejandro']","['Santana Ormeño, Martín']",Factores críticos de éxito para el uso de micropagos en el sector no bancarizado,"En la actualidad, los micropagos comprenden un alto porcentaje de las transacciones realizadas de forma diaria, permitiendo el desarrollo del comercio en sus diferentes variantes a nivel mundial. Sin embargo, en el Perú y en América Latina, existe un porcentaje alto de la población que no utiliza medios electrónicos o digitales para satisfacer sus necesidades de compra y consumo, realizando transacciones tradicionales a través de pagos en efectivo y evitando generar información que permita a las instituciones financieras definir servicios y productos a medida de las necesidades de la población, ampliando los niveles de no bancarización en el país. La literatura expone factores que permiten reducir esta brecha, facilitando el uso de micropagos en el sector no bancarizado como la regulación de los servicios financieros, la infraestructura tecnológica, las características de lo micropagos entre otros. En total seis factores que este estudio identificó y clasificó como factores críticos de éxito, en base al juicio experto de profesionales participantes en diferentes sectores relacionados. Los hallazgos permiten conocer el escenario actual de los micropagos en el contexto peruano, los factores a considerar para su impulso y un ecosistema de inclusión financiera de aplicación en beneficio del sector no bancarizado del Perú.",2021,Universidad ESAN,['Magíster en Dirección de Tecnologías de la Información']
"['León Plasencia, César Iván']","['Moarri Nohra, Richard']",Modelo de solución de Business Intelligence y Machine Learning para el monitoreo y control de calidad de la medición del consumo de agua en el Centro de Servicios Breña,"La presente tesis de investigación tiene como objetivo realizar un estudio de los principales factores asociados a la conexión domiciliaria de agua potable y determinar su incidencia en la medición del consumo de los clientes que hacen uso del servicio. Teniendo en cuenta esta información, se proponen modelos de solución tecnológica basada en Business Intelligence y Machine Learning que permiten monitorear y controlar la calidad de medición del consumo de agua en el Centro de Servicios Breña de la empresa SEDAPAL.",2020,Universidad ESAN,['Magíster en Dirección de Tecnologías de la Información']
"['Gastulo Salazar, Luis Miguel']","['Cuervo Guzmán, Sergio']",Factores que  influyen en la adopción de Cloud Computing en las Cooperativas de Ahorro y Crédito (COOPAC) en Lima,"Para poder identificar los factores que afectan la adopción del Cloud Computing en las organizaciones COOPAC en Lima, se realizaron estudios cualitativos y cuantitativos. Como parte de la obtención de los resultado por medio de los análisis cualitativo de la investigación se pudo conocer los factores que afectan la adopción del Cloud Computing en las organizaciones COOPAC en Lima, evidenciando que los factores: Ventaja relativa o competitividad, Seguridad y Confianza, Disponibilidad tecnológica, Gestión de la información, Adaptación, Complejidad, Crecimiento de empresa, Apoyo de la Alta Gerencia, Mejora en el tiempo y Reducción de costos; figuran como los 10 principales factores que afectan la adopción del Cloud Computing según los expertos entrevistados. Con respecto al análisis cuantitativo se recopiló la información a través de un instrumento que consta de 76 preguntas, este se confeccionó por medio de la recopilación de información del marco conceptual así como de juicio de expertos, la cual tiene como finalidad identificar los factores que influyen en la adopción del Cloud Computing dentro de las Cooperativas de ahorro y crédito en Lima. Conforme lo anterior y bajo el análisis realizado, se obtuvo los 7 factores que finalmente son: Regulaciones e interacción, Cultura Organizacional y Capacitación, Crecimiento de la empresa, Gestión de la información, Uso de nuevas tecnologías y seguridad, Proveedores de servicios y Partes interesadas.",2020,Universidad ESAN,['Magíster en Dirección de Tecnologías de la Información']
"['Florián Asca, Jhonny Tulio', 'Merino Rivera, José Luis', 'Rojas Osorio, Luis Orlando', 'Saavedra Quispe, Kenneth Rodrigo']","['Moarri Nohra, Richard']",Plataforma virtual de intercambio colaborativo de productos en Perú : “Truequeando”,"Proyecto que busca analizar la viabilidad económica de una plataforma virtual de intercambio colaborativo de productos de segunda mano llamada “Truequeando”, para ello nos apoyaremos en el actual apogeo de la economía colaborativa y las
facilidades brindadas como consecuencia de los avances tecnológicos y las redes sociales para su difusión y captación de clientes. Para su desarrollo realizamos un estudio del mercado que nos permitió determinar nuestro público objetivo de Millennials que radican en Lima Metropolitana pertenecientes al sector socioeconómico B y C. Esto, debido a que sus patrones comportamentales, intereses y uso de medios digitales se encuentran alineados a nuestra propuesta de valor. Truequeando funciona como un canal o intermediario que facilita la búsqueda y comunicación entre personas que desean intercambiar productos que ya no utilizan por algo que necesitan. Lo cual permitirá no solo apoyar con la reducción del consumismo, sino también evitar posibles problemas de salud a causa de bacterias y hongos por el almacenamiento de productos, y la necesidad de contar con un espacio determinado para su almacenamiento. Finalmente, luego de realizar las evaluaciones respecto a los indicadores financieros y económicos, se concluye que el modelo de negocio propuesto es viable y rentable para su implementación.",2020,Universidad ESAN,['Magíster en Dirección de Tecnologías de la Información']
"['Fernández Infanzón, Luz Isabel', 'Huarac Cuizano, Yvan Manuel']","['Santana Ormeño, Martín']",Plan de negocio para integrar a las IPRESS con una plataforma de historia clínica electrónica (HCE) utilizando tecnología blockchain,"El plan de negocio propuesto en la presente tesis, propone la creación de un servicio que permita a las Instituciones prestadoras de salud (IPRESS) privadas, integrarse a una plataforma de Historia Clínica Electrónica (HCE) única; esta plataforma estará soportada por la tecnología Blockchain, Verificación Biométrica e Interoperabilidad, las cuales, permitirán garantizar la confianza, integridad, seguridad e inmutabilidad de la información del paciente. Además, esta propuesta toma como oportunidad las iniciativas digitales del MINSA (Plasmadas en resolución ministerial), de lograr la integración total de las Instituciones prestadoras de salud privadas y públicas a su Registro Nacional de Historia Clínica Electrónica (RENHICE). Dado este contexto, se realizó una investigación del mercado, entrevistando a los stakeholders de las IPRESS entre el personal médico, administrativo y TI; validando la problemática, permitiéndonos desarrollar un modelo de negocio que permitirá brindar un servicio de acceso  a la HCE que resuelva la problemática inherente a la Historia Clínica física e informatizada, integrando a las IPRESS privadas con las IPRESS públicas a través del RENHICE del MINSA, logrando así una diferencia en el sector salud a través del uso de las tecnologías de información propuestas. Finalmente, este documento servirá como referencia para estudios a nivel académico y profesional, ya que brinda un modelo de negocio usando tecnología disruptiva.",2021,Universidad ESAN,['Magíster en Dirección de Tecnologías de la Información']
"['Farro Veramendi, Luisa Isabel', 'López Peña, Jhon Erick', 'León Alegría, Vladimir', 'Pinedo Flores, José Antonio', 'Vento Meza, Mauro Luis']","['Santana Ormeño, Martín']",Plan de negocio basado en E-Health para el monitoreo de pacientes diagnosticados con hipertensión arterial en Lima Metropolitana,"La prevalencia de enfermedades crónicas tales como la Hipertensión Arterial Alta es uno de los principales retos a los que se enfrenta el sistema de salud, entre ellos la elevada tasa de mortandad y el costo de su tratamiento, teniendo que destinar gran presupuesto a la atención de estos pacientes. Ante ello nace una nueva tendencia conocida como eHealth la cual hace uso de las tecnologías de información aplicadas a la atención médica. El presente modelo de negocio “QualityHealth” constituye una experiencia pionera en Perú dentro del sector salud que ofrece el telemonitoreo a través de dispositivos wearables, permitiendo el constante monitoreo y apoyo a distancia a pacientes hipertensos. QualityHealth busca mejorar la adherencia al tratamiento del paciente hipertenso con el propósito de evitar complicaciones que deterioren su salud y generar ahorros tanto al paciente como al sistema de salud a través del: telemonitoreo y teleconsulta en cualquier momento y lugar a través de IoT; foros especializados; botón de pánico que contactará de manera inmediata al grupo de apoyo del paciente en el caso de que su presión arterial supere los umbrales; historial de la presión arterial que permitirá realizar un análisis preventivo con ayuda de Machine Learning, alertas y recordatorios del tratamiento entre otros.",2020,Universidad ESAN,['Magíster en Dirección de Tecnologías de la Información']
"['Chuyes Pineda, Isabel Beatriz', 'Coz Puelles, Renzo Gino', 'Cuya Vera, Claudia Aida Ximena', 'Rouillon Sixto, CésarElías']","['Santana Ormeño, Martín']",Análisis de viabilidad del negocio de financiamiento colaborativo digital basado en juntas,"Ante la necesidad de obtener un bien o servicio las entidades financieras ofrecen diversas propuestas que no terminan de satisfacer a los usuarios. Las elevadas tasas de los créditos, cobros ocultos, lenguaje poco comprensible y la burocracia de los procesos enmarcan una problemática que motiva el planteamiento de un modelo de negocios que consiste en una solución de financiamiento colectivo digital basado en juntas la cual permitirá acceder a una fuente de financiamiento con tasa asequible, información transparente, sin procesos burocráticos y que a su vez contribuya a fomentar la cultura de ahorro. Con el fin de validar el negocio se realiza un estudio de mercado en el que se consulta fuentes secundarias, se realiza entrevistas a usuarios potenciales y expertos en rubros relacionados al sistema financiero, fondos colectivos y Fintechs. Por otro lado, se analiza en el entorno las condiciones para el desarrollo del negocio. En dicho análisis resalta la Pandemia por el COVID-19, que incentiva la búsqueda de fuentes de financiamiento e impulsa la adopción de la tecnología y transacciones en línea ante el distanciamiento social generando una nueva realidad propicia para la oferta de Junta+. Asimismo, se revisa el panorama legal de las empresas financieras-tecnológicas, Fintechs.",2020,Universidad ESAN,['Magíster en Dirección de Tecnologías de la Información']
"['Luna Izquierdo, Adolfo Eliseo', 'Neyra Jaico, Omar Abel', 'Ponce León, Edwin', 'Porras Quispe, Mariella Isabel', 'Vega Asto, Pedro Ahmed Kevin Gonzalo']","['Cuervo Guzmán, Sergio']",Trustport : plataforma única de pago para el transporte público en Lima y Callao,"Trustport, es un modelo de negocio enfocado a centralizar los diversos medios de pagos en el transporte público de Lima y Callao, permitiendo al usuario ahorrar dinero, tiempo y mejorando la experiencia en el uso del servicio. Actualmente se tienen diversos medios de transporte y el sistema de recaudo es independiente por cada uno. Con la creación del ATU, se toma la decisión a mediano plazo de poder tener un único sistema de recaudo, que permita gestionar mejor el tarifario. La integración del sistema de recaudo y la revisión de contratos de las empresas de transporte, permitirá tener una mejor oferta de pasajes, ofreciendo precios estandarizados y paquetizados que permitan usar diversos servicios al mismo precio, o, en su defecto, tener menores precios por cada pasaje al comprar en paquete. La integración del sistema de pago con Trustport, permitirá hacer uso de saldos de viajes en diversos medios de transporte, hacer un trasbordo, realizar recargas online y compartir saldos entre los usuarios; además, tener información en tiempo real para tomar la mejor decisión de elegir la ruta idónea para el viaje. La información que se enviará a las empresas será vital para mejorar la frecuencia y distribución de las líneas de transporte.",2020,Universidad ESAN,['Magíster en Dirección de Tecnologías de la Información']
"['Benavente Quesquén, Jorge Enrique', 'Flores Rodas, Jorge Leonaldo', 'Junchaya Pachas, José Alberto', 'Vizcarra Costa, Rafael Fernando']","['Velásquez Salazar, Germán']","Plan de negocio para la implementación de una empresa que brinde servicios de Procurement a través de una plataforma web B2B: Las Compras, una Solución Tecnológica","El plan de negocio que presentamos a continuación se basa en una plataforma tecnológica E-Procurement llamada BUY2BUYERS, la cual se implementará en la plataforma de servicios cloud de Google (GCP). Como función principal, permite realizar compras y ventas corporativas. Conecta a empresas consumidoras con empresas proveedoras, es decir; Es una plataforma que trabaja en la modalidad de Business to Business (B2B).
A través de la plataforma BUY2BUYERS las empresas registradas con perfil Consumidor podrán enviar requerimientos de cotización. Los consumidores podrán seleccionar desde una ventana de categorías, los diferentes productos que necesitan para mantener la normal operación de sus actividades. Estos requerimientos serán enviados y notificados a las empresas registradas con perfil Proveedor. 
Funciones adicionales de la plataforma BUY2BUYERS son la generación del pedido de cotización, elaboración de cuadros comparativos automáticos, generación de pedidos de compra, recordatorios de compras recurrentes, notificaciones e integraciones con software propietarios para obtener una interacción con la realidad de la compañía que mediante herramientas de tendencia tecnológica le brindaran la proactividad necesaria con la finalidad de realizar una forma correcta de comprar (Comprar bien). Para el diseño del plan de negocio hemos utilizado la herramienta Lean Canvas que permite conceptualizar el modelo de negocio. Esta herramienta es la recomendada para empresas digitales o startup tecnológicas donde abarcamos 4 grandes áreas como son Clientes, Oferta, Infraestructura y Viabilidad económica.",2020,Universidad ESAN,['Magíster en Dirección de Tecnologías de la Información']
"['Fernández Gómez, Fernando Martín', 'Orrillo Abanto, Segundo Javier', 'Sáenz Ruiz, Carlos Roberto', 'Sam Puche, Sammy', 'Zárate Araoz, Christian Raúl']","['Moarri Nohra, Richard']","Propuesta de un plan de negocio, basado en tecnología, para atención de consultas e incidentes relacionados a dispositivos electrónicos","El servicio de soporte técnico se ha venido prestando de manera tradicional a lo largo del tiempo. Sin embargo, no se ha evidenciado la existencia de algún proveedor, que brinde este servicio de manera integral, siendo independiente del dispositivo, marca y plataforma. En ese sentido, la presente tesis, propone un modelo de negocio que, fundamentándose en tecnología como elemento diferenciador, busca atender las consultas e incidentes de los usuarios de manera integral, eliminando la complejidad de buscar al proveedor que compete un determinado incidente. Asimismo, el uso de tecnología, permitirá brindar un primer nivel de servicio totalmente gratuito, y otro pagado, que será el que generaría ingresos a la empresa. En ambos casos, se buscará maximizar la eficiencia en cuanto a operaciones y calidad del servicio. Finalmente, se ha contemplado también el uso de tecnología analítica, que permita mejorar las operaciones de la empresa a lo largo del tiempo. Por ejemplo, mediante la consulta a bases de datos de conocimiento, lo cual permitirá una mayor eficiencia en la solución de incidentes.",2020,Universidad ESAN,['Magíster en Dirección de Tecnologías de la Información']
"['Carpio Allauca, Raúl Marcelo', 'López Bruno, Alejandro Yimi', 'Munayco Coronado, Roberto Willy', 'Rocha Horna, Johan Daniel', 'Vega Loayza, Luis Alejandro']","['Arbaiza Fermini, Lydia Aurora']",Plan de negocios para la creación de un sistema de fidelización de clientes para empresas del sector gastronómico en la zona 7 de Lima Metropolitana,"El presente plan de negocios tiene como objetivo determinar la viabilidad de crear un sistema de fidelización de clientes para empresas del rubro gastronómico en Lima, a partir de una aplicación móvil, debido a que existe un público desatendido que viene utilizando cada vez más las apps con fines de obtener beneficios. El estudio de mercado cuantitativo arrojó el perfil de los posibles clientes, basados en su género, edad, nivel de ingresos, preferencia de comidas, periodicidad de consumo y gasto promedio mensual. En cuanto a la investigación de mercado cualitativa, los expertos consideran que existe una brecha entre la oferta y la demanda de este tipo de servicios, lo que proporciona una oportunidad de negocio. En el análisis de factores externo se identificaron como principales oportunidades el crecimiento del e-commerce en los últimos periodos, así como la penetración de los teléfonos inteligentes. Las amenazas más fuertes son la competencia que puede darse debido a las barreras de entradas casi inexistentes del sector.",2020,Universidad ESAN,['Magíster en Dirección de Tecnologías de la Información']
"['Lévano Acosta, Luis Fernando Félix', 'Mejia García, Luis Marvin', 'Mendez Anchante, Christian Miguel', 'Palomino Vilchez, Paul Fernando', 'Torres Reyes, Francisco Javier']","['Cuervo Guzmán, Sergio']",Plan de negocio para la implementación de registro digital de documentación notarial utilizando tecnología Blockchain,"El plan de negocio que se desarrolla en el presente proyecto de tesis, es sobre una plataforma tecnológica basada en blockchain para el registro de documentos notariales ofreciendo características como integridad, seguridad, inmutabilidad, accesibilidad y visibilidad. De esta manera las notarías, mediante esta plataforma, brindarán a sus clientes una alternativa digital con la misma validez que el documento físico. Asimismo, esta alternativa les significaría una fuente de ingresos y un valor agregado a los servicios notariales que actualmente son ofrecidos en este mercado. Debido que el sector notarial de Lima Metropolitana busca una evolución en sus servicios actuales, se realizó una investigación de mercado y entrevistas a expertos tecnológicos en blokchain, desarrollando una propuesta de modelo de negocio que aprovecha las características tecnológicas del blockchain para ofrecer un valor de diferenciación a los usuarios finales, a su vez realizando un análisis del mercado actual y su desarrollo. Siendo la tecnología propuesta una alternativa superior a otras actuales como la firma digital, todo esto para evitar problemas como la falsificación de documentos o delitos contra la fe pública. Sirviendo este documento como referencia para estudios en el sector notarial peruano y a nivel tecnológico para nuevos modelos de negocio utilizando tecnologías disruptivas.",2020,Universidad ESAN,['Magíster en Dirección de Tecnologías de la Información']
